{
  "version": 1,
  "identity": {
    "id": "example-project",
    "repo": "/srv/projects/example-project",
    "adapter": "example-project",
    "default_branch": "main"
  },
  "scanner": {
    "version": 1,
    "owner": "deterministic-scanner",
    "status": "ok",
    "repo": {
      "exists": true,
      "head": "abc123",
      "worktree_clean": true
    },
    "facts": {
      "languages": ["python"],
      "package_managers": ["pip"],
      "ci_files": [".github/workflows/tests.yml"],
      "test_files": ["tests/test_example.py"],
      "project_local_adapter": false
    },
    "findings": []
  },
  "draft": {
    "owner": "project-add",
    "binding": {"enabled": false},
    "adapter": {
      "setup": {"commands": ["python -m pip install -e ."]},
      "smoke": {"command": "python -m compileall ummanu"},
      "validation": {"ci": "github"},
      "artifact_policy": {"write_project_files": false}
    }
  },
  "provision": {
    "owner": "provision-agent",
    "status": "drafted",
    "binding": {"enabled": false},
    "adapter": {
      "setup": {"commands": ["python -m pip install -e ."]},
      "smoke": {"command": "python -m compileall ummanu"},
      "validation": {"ci": "github"},
      "artifact_policy": {"write_project_files": false}
    },
    "findings": []
  },
  "gate": {
    "owner": "onboarding-gate",
    "status": "passed",
    "checks": {
      "clean_worktree": "passed",
      "setup": "passed",
      "smoke": "passed",
      "validation": "passed",
      "artifact_policy": "passed"
    },
    "binding": {"enabled": true},
    "findings": []
  },
  "ownership": {
    "binding": {
      "draft_owner": "project-add",
      "enable_owner": "onboarding-gate",
      "initial_enabled": false
    },
    "adapter": {
      "draft_owner": "project-add",
      "provision_owner": "provision-agent",
      "storage": "secretary-instance/adapters/<project>.yaml"
    },
    "enable_transition": {
      "only_when": "gate.status == passed",
      "forbidden_owners": ["deterministic-scanner", "project-add", "provision-agent"]
    }
  }
}
